score,userName,review
1,"A, S, Mr.","I like the idea of having a healthy relationship to our emotions and I’m often prone to downloading self help apps. This app, though elegantly designed made me pause. There are bizarre, cold videos of “experts?” telling you to deal with your “emotion” in the same way that an asocial doctor would examine bacteria on a Petri dish. Why are we as humans, as the messy, emotional, bewildering creatures that we are, trying to make ourselves into machines. Things that can be plugged into diagnostics software and reprogrammed for optimality? Self awareness is a great thing, but is that what technology is giving us? Or is it giving us self restriction? Self judgement? Self-denial?"
5,lady_llama,My therapist recommended this as a way to track my moods and make myself more aware of my feelings and the triggers for the not so fun ones. Been using it faithfully for almost a month now and it’s been a big help. This is a well thought out and easy to use method of mood tracking than I’ve seen in a while.
5,readingdude756,The whole app is very clean and straightforward. I enjoy how simple they show the emotions as colors and bite size information about what this emotion generally means. The apps flexibility with how much or little you want to make it a journal with emotions is very nice as well. There are minor things that I would like to see but dont effect the use ability of the app
5,guest9335618,"I am a pediatric psychiatric provider. After trying the app myself, I was blown away by the data and trends I could identify. I have since started recommending the app to all of my patients and many friends and colleagues. Marvelous for identifying patterns and trends in mood fluctuations and also offers tools and education to further empower you on your journey!"
5,marceliinee,"im autistic and it makes describing emotions accurately is really hard for me without figuring it out. I love all the descriptions here and how transparent they are, especially being able to log and see the statistics them.  I have noticed more emotions were added, but they are only visible from the search bar and not the initial screen."
5,iam_violet,"I love this. It’s one of the few apps out there that truly has no ads or in-app purchases, it’s well-designed, and just the kind of mood tracker/journal I’ve been looking for. I will say a fully iPad compatible app would be great, and also the ability to back up/sync between devices using your Apple account. Honestly it’s amazing as-is though."
5,kstorjohann3,"I’m a psychology student looking into becoming an emotions researcher and I truly love this app. It’s exactly what I’ve been looking for in a diary, I’m obsessed with the emotional regulation techniques, and then 10-part Emotions 101 videos were so helpful! I just hope this app reaches the audience it deserves and I hope to continue the work of providing emotional literacy to the public just as this app does so well."
5,omg take my nickname,"The app is beautifully made and its premise is wonderful. I love that it’s free and helping its users understand their emotions—initiatives like this truly do their little part to make the world better.  The design and UI is intuitive and very attractive. The flow of the app is smooth and picking out your emotion from the emotion compass is a visual treat.   Overall a very, very well made and thoughtful app."
3,Mooooooons,"I tracked the weather for a month and my data never appeared, probably because when I clicked entered it said ‘update steps’ rather than weather. It looks like there was an update that shows the weather, but the range is very odd and doesn’t show my monthly data. It goes from -132 to 176 degrees, in 44 degree intervals which doesn’t make sense. I also wish it kept the entries answering ‘why I’m feeling this way’ were saved / visible"
5,franthemaneiei,"I have downloaded every mental health app that I could find, and have not been nearly as satisfied as I am with this one. I’m currently in the depths of my depression, and I’m using every avenue to getting help that is available to me. I’m so blessed to have found this one, and especially that it’s free and remains free by others’ donations. Thank you so much to the creators and editors, and to the donators."
5,JJHill10,I have been using this app to keep myself vigilant and aware of my day-to-day experiences and emotions. It has been a huge help and has made me much more capable of monitoring myself and understanding my behaviors and emotions. I highly recommend using this app if you are interested in improving your mental health or simply understanding and interacting with your feelings on a regular basis!
4,lifeguardswimmer,"I love this app and have really benefited from it! My only complaint is that you all took away the “return”/shift button when adding a description onto a log. Sometimes I need the space in between certain thoughts and need to really separate them while still keeping them in the same log. It bothers me that everything is now crammed into one paragraph, it makes me anxious lol. Please bring it back."
5,mb62609,"Easy and quick to use so I can track my moods throughout the day. I use this to detect when I may be entering a PMDD or depressive episode. I’ve also found that by labeling my emotions I am getting better at expressly them. Journal feature is good to provide context for the feelings, and tags are helpful to see when/where certain emotions arise."
5,Homo😼,I have been using this app for a couple of weeks and it’s really good. There are a lot of good qualities about it. Such as you can actually put more than one feeling. It also actually tracks them and how you felt for that week and not just not tracking them like other apps. I would definitely recommend 🙂
5,clxxdy-days,I love this app so much. I get bored with apps like this really easily normally and feel so pressured to come back each day that I delete it. With this app I feel no pressure whatsoever and it helps me get my feelings out without having to talk to somebody about them. The lessons are extremely helpful too and help me cope with my emotions. This app is so great and I would recommend to everyone!
5,baaed6409,Only been using this for a week but I absolutely love the color scheme and especially especially the feature of having a clear definition of each emotion. I love that because it’s been making me really think about and ask myself if the particular emotion is really what I’m feeling. Somewhat nudging me to take a deeper analysis of what I’m experiencing.
5,yane1987dugan,I have had problems identifying feelings and emotions my whole life. This app has been like a rescue tool for me. I share my emotions with my daughter using the share feature. This app is free and has made a difference in the way I perceive my inner world since the day #1 I started using it. Thank you to whoever came up with the idea of this app. God bless you!
5,treehugger❤️🌴🌳🌸🌺,"This app is so relaxing, and the first time i tried it and saw how many emotions to pick from, I just knew this app would be a fav! and it also only notifies you on checking in! i know this is a short review, but that’s because i first got this app. All in all i would give this 4.8 stars if i could. (it’s great, but there’s always room for improvement!)"
4,xavier73129,"Overall, I enjoy this app a lot and it’s definitely been very helpful for me, but since the recent update, there’s now an extra step to type in commentary, which I thought was already covered in the previous layout.   Would be nice to either turn that off or maybe revert back to what it used to look like?"
4,Johojojojo1234567,"The “mood meter” that I often recommend and use with client as a psychotherapist has been rebranded!  I think it’s fascinating what our emotions look like as “data”, and what the practice on mindfulness and insight building can give to us.  I am happy to see they’ve added the ability to set prompts! However, a huge blindspot remains in ignoring the BODY.  Users: add to your journal section! What is your body saying? What are your eyes and breath doing? Your face? Is there stress? Pain? Strain? Activity? Lack of activity? What can you feel or not feel? Are you feeling hyperactive? Hypoactive? Are you holding your body in a certain posture? Your body might tell a story that your mind and emotions aren’t tuned into. Give it some consideration."
5,C1273,"A friend suggested I download this app so we could check in with one another and it’s been great! I find it extremely helpful in being specific with naming confusing emotions, seeing trends in how i’m feeling, and paying more attention to my needs. I love how many features there are for being a free app! I highly recommend downloading :)"
5,Purrrrrring,I see why this app is award-winning after using it a week!! It is so well thought out and incredibly easy to use. I recommend this app to everyone who wants to track their emotions. This app covers everything in one app. Try it for a week and you will see but it has to offer. It’s quite amazing what they’ve done. :)
2,FudgeIsGreatFudgeIsGood,"After updating the app every time I tried open it, it would crash. So I finally decided to delete it and redownload it. Once I redownloaded it I found that all of my data had been deleted. Which is really disappointing since I really liked this app and the interface. I feel like it was really helping me but at this point I’d rather just write down my emotions and actually have reliable backup data of my entries rather than using an app that will delete it all after updating."
3,OrionEridanus,The AI reflect tool does not always render well. The screen scrolls the bottom “finish” button to the top of the screen anx  just shows blank screen below and I can’t read the AI message. This happens sometimes and nearly always when select “go deeper.” I find the AI tool responses helpful for further self reflection and it is annoying that much of the time I can’t read them.   I am running iOS 18 on an iPhone 12
4,Last Update Problem,"I love this app. I use it every day, 4x/day. I’m able to track my mood against menstrual cycles, work stress, family conflict, etc. But there are days that I feel fairly neutral, and it does not fit into the four categories of emotions that are provided. I wish there was a fifth category that sits in between the rest where it reflects these days better. Examples would be “present”, “neutral”, “meditative”, etc."
5,IvyPie723,I downloaded this app with the goal of having more awareness of my emotions. I love that it helps me find words to describe what I’m feeling. The short videos are helpful and motivational. I love the idea of being able to step back with perspective and analyze my emotions. It helps to have that degree of separation. It’s a great reminder that we are not our emotions or our thoughts.
5,Frozencoastie,"I’m grateful for this app. My struggle has been to put a meaning name to my emotions allowing me to communicate how I feel with others, or just recognize and accepting a feeling. This is a simple and power app and as a bonus (not counting the matrices) is the videos walking me through a better understanding of myself. So yes, I love this app and definitely recommend for others."
5,1youngtolo,I am now an emotional scientist because of this app instead of rarely having good days I now have the ability to create good days and everyday is an adventure because I never know what emotion will pilot me into creating something incredible  Imagine an artist who learned how to control their emotions  I am so elated confident and proud because of this app
4,Leftie here,"I love this app it’s helped me stabilize. I have the following improvements though. It should ask to connect to step counting, exercise, sleeping and meditation apps. Tracking this information in multiple locations is annoying. The step counter in Apple health seems like an obvious improvement same with some major meditation apps.   Over all still love it!"
5,Acoustiks2006,"Capturing my moods and emotions throughout the day in a wonderfully organized way - multiple ways really - is a great feature.  The notes section has served as a good journal unexpectedly.  I write A LOT everyday.  The videos are free and full of great mental exercises or just good advice in general.  Been very good for my mental health - thank you for this free app, it should be nominated or recognized somehow.  Well done 👏🏻"
5,Lorree22,"Quick and customizable mood tracker. The 4 quadrants really help with the process and I like being able to track the trends very quickly by tapping on common or customizable answers (what are you doing, where are you, who are you with). It also offers insights and practices to process the emotions. And it’s free! Very thankful for this app."
4,Esh217,Good practice to get in the habit of tracking emotions but wish I could adjust times of log when I forget to do it exactly at the time I’m feeling the emotion. Also having issues where I click to log emotion and the screen is “black” so I can’t type background on why I’m feeling a certain kind of way. I have to close the app and go back in to adjust.
5,Hamprincesse,"Wow this is such a great tool to help understand our emotions, mood, and much more. Lot of good videos and resources to help along the way. I like that you can share how are you feeling with others. My family and I are using it and sharing. We love it. Thank you to the developers of this app for providing such an amazing tool. Not to mention it’s completely FREE"
5,SW1FT 67,"I have literally only been using this app for 5 days and I feel like it has changed my life. I never knew that the 17 year old guy that I am lacked so much emotional intelligence! I actually feel like I can describe my emotions to my girlfriend and it’s helped at lot. Props to this app, I recommend everyone start using it!"
5,mariesey1986,Thank you for the team who created this app. I struggle to articulate what I feel and I often find myself twisted in knots at the end of the day. I love all the little moodlets with definitions. The short videos and lessons are very helpful. This is a great tool to have if you struggle with anything especially regulating your emotions.
5,1ThinkingThoughts,"I started using this app and have been so impressed. I have tried many different “feelings” apps. At first look, this app seemed like the rest but it didn’t take much exploring to see that I is much more than a feelings log. The videos offered by professionals are like free, mini therapy sessions!! Such a great resource I have shared with others."
5,Mitchell_J_101,"Do you feel constant stress or anxiety? I did, and this app helps me understand better what that means and how to better manage those unpleasant feelings. It gives me a large word bank I can use to describe what exactly what I’m feeling, and has an amazing database of exercises and lessons on what to do when experiencing pain or joy. I’m so thankful for this free tool."
4,sunnyhae,"love this app!! helps me to be more in touch with my emotions and keep track of what it was like when i felt those emotions. one thing i hope the app can do later on is Sync data across devices! especially if i move to a new phone, id love to download the app, sign in, and still see my old entries from my previous phone and from other devices"
5,beepboopbuuubeep,"I have been using this app for a week and it’s helped me identify my emotions so I can better work through them. I’m in therapy for C-PTSD and ADHD, and this app is a game changer for helping me name my emotion. I love the user interface and how easily it integrates with the Health App. Seeing how my physical health interacts with my mental health is very helpful. The app is also visually pleasing which keeps me engaged."
5,Nekaybaw 💕,"Amazing app! I truly recommend this app for anyone looking to better understand and keep track of their emotions. Since using this app, I’ve come to understand exactly what I’m feeling (or close to) and it’s helped me so much with self control. I also LOVE that the app is FREE and ACCESIBLE to everyone! God bless the developers & creators of this wonderful app! A blessing! ❤️"
5,Sydney Simnitt,This app has been very helpful in tracking my moods and seeing how long I’m in each state for. I’ve been mood tracking with my therapist and found this app and it’s WAY better than writing it down each day. Looking at the analysis over time and my trends has been very insightful on my self-awareness journey.
4,brina 💀,"this app is rlly a great way to express your feelings!! if you don’t have anyone to talk to or need or want to learn more abt emotions this app has hot you covered, and sometimes it’s just nice to compare how you feel in the morning to how you feel in the afternoon! you can also check in whenever you have time, and you can set a schedule so maybe you get home from work at 3:30 and want to check in, you can!! this app will send you a notification to remind you “hey, let’s check in and see how you feel” it won’t say that, but it will say something similar. i honestly could go on and on abt this awesome app, but i people to figure out everything else that’s great abt this app!!"
5,alex norrenberns,"I’m in love with this app and the joy it has brought to my life, as well as those around me. I got my friends and family to download it. It is nice to get notifications on how they are doing. and i love how simple it is. 10/10 reccomend. Thank you to the team who made this"
5,8/11/22,"Last night around 9 maybe? My iPhone kept pinging with notifications for a check in from this app. I don’t know if it was this app, or my phone that made it happen. But it was as if someone was calling and it never stops. That’s how fast the notifications happened for 4-5 minutes straight."
4,Justsayingthisis,I enjoy this app but I do wish there were more options for feelings. I know there’s a good amount already but I still sometimes feel like I can’t find one that accurately describes how I’m feeling in the moment. I just pick the closes one then leave a note stating how I was actually feeling. Like I’m not always high or low energy and meh isn’t a middle ground enough descriptor for me
4,Typefreak,I’ve been using this app for a month and it’s been helpful. I use the reminder setting so it checks in with me at certain times in a day to see how I’m doing- this is something that I’ve been trying to do lately.  The only thing is I wish that we could add our own feelings because I feel limited by the current selection.
5,Bearperson🧸,This app is really helpful and good for you. It is a way to channel your emotions and it has great words that you can add to your vocabulary. If you ever put in that you have anger or sadness the app suggests videos you can watch to make you feel better. I like this app a lot and I would definitely recommend it. Thank you!
5,Rafic.kd,As a life coach I always encounter moments where people are stuck and couldn’t identify how they feel let alone the why. How We Feel is a great tool to support and empower people of all walks of life and age to identify and get in touch with their feeling in order to grow both emotionally and mentally
3,rernyc,"I’m writing this review because there is no contact listed whatsoever on the developer website and Apple also won’t let me report an issue. I’ve only been on maybe three days, and now today every time I attempt to open the app, it shuts down immediately. The previous days it was fine. If this continues, I will be deleting the app. Could have been a helpful app."
5,jeremy studebaker,"This app is great. Most apps like this make you pay so it’s honestly great that this one is free! The user interface is super clean and looks great. The color choices for the different emotion categories don’t make total sense to me, but that’s such a personal preference thing that I can’t fault them for it. That’s really my only gripe about this app too."
5,M2DNA,this app helps me out so much. Helps me label. The emotions I’m feeling helps me to track of my days helps me realize that my emotions are dependent on so many variables. I love that it connects to the Apple Watch and my workouts and the weather. my only suggestion is that it connects to the new Apple feelings journal.
5,Melis811,I love the ability to have random notifications and reminders to check in! It will give me a better idea of how I’m doing on a regular basis and not just when I think of checking in. So helpful to get connected to myself. And I love the tips for regulation as well. Thanks so much for your work on this!
5,"Would be five, but","It has the perfect opportunity to track my moods and also my mental state at the time I’m writing, has a place for notes to add more detail. I wish I could log past days. I often forget to log my days when I’m notified bc I’m super busy. I just hate missing days because I was busy"
4,KMGs Mom,"This app is amazing. I love that it captures so many aspects that can contribute to how you are feeling …where you are, who you are with, the weather , etc. I also love that you can add a photo, voice note or jot down a few words about what’s going on when you do your check-ins. The videos are great too. I told my therapist about this app so she could share it with other clients."
5,A’Lyah,"I’m going through trauma therapy, and one of the things we need to be aware of is our mood. Being able to track my mood and the data along side it literally helps with that. Ive been using this app for a year now, and I’m going to recommend this to my support group."
4,Zari_Kayy,Love this app so far! The concept is brilliant. It’s not like anything I’ve seen before. One suggestion for the developers: allow us to select multiple “what are you doing” items since we are sometimes doing more than one thing at a time. (Ex: listening to music and painting)  I couldn’t find a “contact us” anywhere so I’m leaving this feedback here :)
4,Safish,"Ive found this app helpful and shared with my therapist, shes been recommending it to her other clients too! Its a great way to check in with myself, just take a minute, get more grounded and aware.   I do feel sometimes like the categories aren’t exactly how i feel, sometimes “meh” can be more neutral to me than negative for example.   I also think it would be easier, instead of the shapes that dont really mean anything to me, if you could use the first few letters of a word instead so at first glance, the “all the emotions you felt” area made more sense. Example here would be just using a circle or square with “apa” for apathetic, something like that.   Thanks for what youre doing! 💚"
5,cocoloco911,"This app has helped my life substantially for the better. The real life tools and education I can instantly use are incredibly helpful. I can’t recommend it enough. Every human needs this app, I had my kids get it too. So grateful for it. The videos and lessons are so professional and helpful. Literally therapy in my pocket."
5,Maia22,"The app is 10/10. This is great for “tagging” your emotions to your entries and visualizing trends of what may be causing your mood to fluctuate. However, the check-in font was perfectly fine. Now I feel like I can only open the app in the privacy of my own home now that it’s so big."
3,DapperGordy,"Hi, I am liking the app so far. However I have accidentally added an entry for the evening upon waking and there doesn’t seem to be a way to edit/remove the entry, via the app or via the Apple health app. There is no FAQ or way to see how to easily contact the developers to find this info. I also am concerned that I cannot see this data in the Apple health app in order to have control over my medical/mental health info. Answers from the devs would be great"
5,hollycmh1,"The app is so simple to use and doesn’t make it so complex and overwhelming to log your emotions like other apps usually do. The colors are a great way to make it visually appealing and they send you a weekly report of your emotions and what you were doing, and it’s all FREE!!!! This app is far superior than the other mental health apps! Love it"
5,JMCoach7,"This app provides a fun way to become curious about our emotions, no matter what they are. Short videos provide good distinctions and information to help us become more emotion scientists rather than emotion judges.  The idea of honing in on emotions by using level of energy combined with a “pleasant” or “unpleasant” rating is genius."
5,MicLZU,"It would be great if multiple people in our family could log in and out of the app, having separate accounts, or some other way to choose who is recording an emotion. My kids are learning a lot from this but they don’t have their own devices."
4,ranch th*t,"I think the range of feelings is great as it is, but sometimes I’m not feeling particularly good or bad, just completely neutral low energy. Maybe add an “unaffected” or “neutral”.  I wish they had more middle ground emotions rather than good vs bad. Looking at my feelings log at first glance would not give you real insight into how I’m feeling, because I’ve had to pick inaccurate ones."
4,FloridaFashions,This is a really decent app- except it’s missing a feeling for something related to anxiety- and that’s killing it for me- none of the existing feelings mean anxious not even close.  The buttons for the emotions could be split in half and you could have double of them and I know you’re trying to keep it KISS - but we need at least some thing to represent anxiety
