score,userName,review
5,Thatone_chick,"I am so thankful for all of the features that this app has and that none of it is behind a paywall. It is so refreshing to see, and i’ve been loving it!! The analysis and integrations are incredible and the app is so easy to use!!"
5,fashion2021queen,I am going through a lot right now and this app has helped me to get over my panic attacks and just anxiety. It has helped me with school depression and helped me to find my voice again.
5,A. Whaley,"I am becoming a “feelings scientist” and am a recovering “feelings judge.” Slowly, I am beginning to be able to sit and feel not just inventory my feelings. It’s helping me become more compassionate towards myself and others."
5,Mom SKK,"AMAZING! I love this App! Today I am learning to name the emotions I never understood that I had.  I was happy, mad, or sad…that was the extent of my self knowledge.  Today my emotional language includes words like elated, apprehensive, serene, fearful to name a few.  Thank you so much for this App!"
5,Margo bear,This app is a great way to stay connected with yourself but also the people around you. It makes it so much easier to provide love and support to the people who need it.
5,alice dibble,The way that emotions are organized has made this the best mood tracker I’ve used. I like how emotions are along a scale of positive/negative and high/low energy; it’s a great way to provide a general overview of emotions while allowing for more specific emotions.
4,aemckean,"And now it keeps crashing. Won’t open at all. I’ve been holding off on doing a delete/reinstall, because I don’t want to lose my progress, but then what good is saving my progress in an app that no longer opens? Right?"
5,Chromachlo,This app is so awesome. I love that it’s fully functional without any annoying ads as it’s funded by donations etc. I told my therapist about the app and she wrote it down. This app is soo special. Thank you!!
5,Easy app2,This app has been great for providing helpful videos on understanding our emotions. It’s also great for journaling the current events around why you are feeling what you are feeling.
5,Rmcd1615,This app is great because I’ve always wanted to be more aware of my own emotions. The fact that it lets you choose from many different emotions helps me to pinpoint my emotion more accurately.
5,mihiker,Great app. Quick to learn. Easy check-ins that let me focus on my emotional state during the day. Short videos give helpful hints for how to improve my well-being.
5,🕷️xx_itzfern_xx🕷️,"i like this app and recommend, just a few bugs, but very playful interface and easy to use 🌸  Edit: i changed it to five stars. this app just keeps getting better and better! the ai really works well. one suggestion, though. Full screen interface. Otherwise, this is awesome. I changed my title from “Always improvement” to “Everyone needs Hwf”  near perfect mental health app. helped so much.   thank you so much! 🕺🍋✨🤟 -xx_itzfern_xx"
5,GSBpooh,The design is intuitive. It makes sense.   I love the reporting aspect of this app. It’s my favorite part. It helps me to understand my triggers visually by using graphs and several points of data. Absolutely in love!
4,Vincy_Princess,I love this app it makes it easy to track my moods. My only complaint is not having the ability to add my mood from the previous day bc sometimes I forget and it would be cool to have that option!
5,KB Board,Pausing to check in is helpful and the week in review is insightful. Very intuitive app. Helping with communication with my spouse as we both is the app separately then share what is happening with our feelings. Love it.
5,Hi 😨,It has so many emotions and you can also pick two for how you felt at the time.  It was much more better and detailed than I expected.
5,Justineheart914,i love this app because it makes me check in with my feelings and when i recognize my feelings i also recognize when i’m happy rather than focusing on when i’m sad or frustrated
4,TypopathicPsychopath,"It really helps me identify and label my own feelings so I can cope with them or manage them. I just wish that I could optionally add a severity to my emotions, or add more than two at once if that messes with statistics.  But otherwise that’s really all I’d add. It’s perfect for me except for that tiny thing."
5,Mcclvswag,I love how it checks on me cause I don’t like talking to people and explaining how I feel just stresses me out and makes me sad and anxious. This app really makes me feel safe to express myself and be my true self.
3,eeemmmgggmmmm,i love this app. but i feel subtitles for the videos would be so helpful. especially for someone like me who often feels overwhelmed and anxious by the sounds of the world. i come here to put my thoughts and feelings down and get some kind of a break and/or clarity. please put subtitles in videos so i can refrain from listening to yet another person talk at me in my already full and overwhelming day. of course a calming voice is very grounding. but for me sometimes all i really need is some silence. so thankful for what this app is trying to do here. it’s very helpful.
5,Bea: The Devourer of Nectar,HWF is so easy to comprehend and aesthetically pleasing. i’ve always wanted to record my feelings to get a gauge on what impacts my emotions. the apps i’ve used before this cost money and too much time. i highly suggest this app to ANYONE and EVERYONE
5,Anniebiogirl,I’ve granted permissions but the import function doesn’t seem to do anything. I’ve checked that it’s set up properly and restarted the app and my phone.
5,L1745D,"absolutely wonderful app if i may, more suggestions: adding feeling with definitions. I’m saying adding the ability to create a custom feeling (still following the low/high positive/negative chart!) and add a custom description."
5,Nafgrand,"I finally been able to label my feelings. In other words, the app has introduced me to know my feelings, helping me to manage and share with my psychiatrist and therapist."
5,AmyHSW,"I share this app with family , friends and children… to help them become familiar with their range of emotions and how often they really do change!"
5,E-Bassed,"My brother introduced this app to me on a whim, and I download it and just recently started using it. I can’t tell you how different it makes me feel, but the ability to acknowledge, abstract, and recontextualize my emotions, I could not begin to describe how much it helps   If you feel lonely, sad, upset Without Reason, I’d definitely check this app out. And even if you Are Upset for Any Reason, this app will help with that too  Peace and Love on Planet Earth! -Ebass"
5,UncleBenFranklin,"An app that helps your mental health unlike the countless ones that hurt it. Ps, whoever did the graphic and sound design for this app is amazing- the small bubbles and soft sounds they make literlsly made me feel calmer as I used it"
5,Dollpanda13,This app is amazing. what I like most about is it gives you video identifying the emotions you identify how do you express it is it is healthy way. and you get a document your mood change.
5,airportrusher,"Unbelievably useful tool for understanding and naming your emotions. The definitions are so helpful, the extra tools and lessons are so well put together. If everyone had this app the world would be a better place."
4,SusanJulia22,I wish there was a comment feature so I can ask my friends why they feel a certain way when they update their mood.
4,Uglydollsforever,I love this app and feel more seen when being able to put words to my daily emotions. The only downfall to this app is that they have no emotion that is numb or nothingness. Which I feel a lot but overall very good app.
5,LJac85,Love everything about this app! The fact that it is free for users but such amazing quality is awesome! So many great features to support mental health! I have recommended it to so many people!
5,Jperkins26,I attempted suicide November of 2018 when I was 20 years old. Having an app like this along with friends who will now have access to my deep intrusive thoughts will help me stay alive. Thank you for this app.
5,Jessie 25100,It's been such a great tool for me because there are definitions for all the emotions. I love that it’s completely free. I just wish you could add more than just one emotion to a single check-in.
5,Trust2Jack,This is the perfect tool for anyone who wants to better understand their own feelings. And shouldn’t everyone want to better understand their feelings? That is to say understand life?
5,mmiyer,"Genuinely one of the most incredible apps I've used, has really helped me know and regulate my emotions. One of the few health apps that actually help because it is so simple to use!"
5,LoopertonJr,"The four quadrants and the ability to label emotions is genius   Labeling emotions means you can understand what you're feeling and identify them. Often times, just being able to identify how you're feeling is enough to feel like you are okay.   I love this.   It's also a very simple app which is incredible. Too many apps these days try to make things overly complicated.   This app keeps it simple and just gets out of the way"
5,jwilczynski1977,Easy. It’s so easy to log my daily emotions.   Really love the lesson videos.   Takes about 2 minutes daily to complete.  And I am honest with myself using the logs.  Was hard for me to do but overtime was simple.
5,ellewms,"This app is incredibly handy in helping to understand, track, and regulate emotions. It’s such a simple concept but it's executed really well. Not surprised by all the great reviews and awards it's garnering. Try it out!"
5,cl3100,"I really didn’t know the words to place my emotions in. This app open my eyes. I’m also thankful that it’s a free app. There’s nothing to buy, it’s funded by donations which makes me really happy. I’m in a better space."
5,Juju6001,"as someone who struggles with mental illness, i find myself fatigued or unmotivated to journal my day, thoughts, feelings, etc. this app was the key to what i always needed. i am reminded daily to check in and i would like to say that 95% of the time i do. the check in can take as little or as much time as needed. it also helps define my feelings throughout the day with an array of color coordinated adjectives to choose from. this is by far my favorite “self help” app!"
5,Jenc269,I had the last version and wondered what happened to it… Now that I found out I’m so so happy it went away! This upgrade is exceptional.
5,jackieohmy,"It's so easy to enjoy and self-enlightening, with encouraging videos interspersed.  i also love the analytics, which helps me quantify instead of thinking that my current state is a permanent one. much gratitude for this app!"
5,/(0-0)/ |__|,"I have had so many ups and downs this week, navigating extreme social disturbances, work, and depression. I have been looking for an app like this, and this is the only one without ads. Thank you."
4,concerned about this,This app worked for me three times but now it keeps crashing upon opening. Really hope you guys can figure it out because i loved it when it worked.
5,Bakerk74,"Someplace to identify and name my feelings, articulate how I’m feeling, connect the dots of why I might be feeling that way, and tools too understand more about how feelings work and how to deal with them."
5,LKB61,Great at helping identify emotions.  The brief definition when you highlight an emotion bubble really helps me to decide if that is the emotion I am experiencing.   I like the videos that look at emotions from different perspectives.
5,laurpups,Gives you the opportunity to create space between you and how you’re feeling. Great videos to uplevel how you respond to your emotions.
5,Annicmattic,Excellent app for your mental and emotional health. I look forward to checking in and (sometimes) sharing how I feel…
5,Pianoman_jack,I got this app to quietly monitor my thoughts until I can see a professional...if that is what you're wondering about this app is the best one out of all the hundreds of choices 🙏
5,adahshav5,"i actually love this app a lot. it’s hard for me to feel determined or to remember to write in a journal everyday, but i always remember to check into this one. it’s quick, simple, and beautifully organized. i love the photo and audio feature. i always explain (through an audio) or picture on why i feel the way i do. it’s more personable and just adds a lot more creativity. this app is also good for regulating my emotions :’)"
5,Daggie619,I have my whole family using it. This app is nice way to pin point exactly “how we feel” and the app gives videos and exercises depending on the emotion feeling.
5,wjanfhjsndbfe,Thank you so much to whoever made this. It’s helped immensely with my ability to feel my emotions and the tools actually make me feel better.
5,Peacefuldolphin,This has helped our family a lot already. It’s helpful to figure out really what you’re feeling!
5,Nostalgic Nerd,i love the simplicity of the app and the statistics it provides and the emotion lessons. I wish they would bring back the ‘Ok’ and ‘Sleepy’ feelings though. Because i’m not necessarily ‘Good’ or ‘Chill’ i’m just about okay.
5,Lolcat Lisa,"I love the graphics, the wide variety of words available to describe my feelings, and the ease of capturing them.  It’s become a daily habit."
5,ChrisCorey🩵🤍,Only been here  a few Weeks and it has helped me in a lot of different ways honestly!!!! I can’t wait to see where I get with this app in just 3 months ❤️ XO CC
5,Julie Ann S,"Grateful to the scientists, doctor's, researcher's, investor's , and the platform. It is like nothing I have ever experienced. All I can say is try it. My 15 year old step son told me his therapist recommended it for him."
5,Noneaaaaaaaa,"Have found this app, helpful and reminding me to have an emotional check every once in a while.  This allows me to know what my next step I want to take."
4,MCotton24,"The app is great, however, what would make it better is if the app synced better with the health app. I have noticed issues in the first couple of days. Wishing that this could be fixed."
5,Crazyluvbug,Absolutely nothing that has tried to asked for money and no ads. Super well built app and helpful for tracking a lot of info. I love this! Already shared online.
5,Laralu$,i recommend this app to folks who struggle to put the word to their feeling big or small and need guidance towards coping sometimes. the free videos are nice to redirect your thoughts. and it tracks your entries so you can see the patterns in yourself. i’ve found it super useful and i told my therapist about it and she said she had a few clients come to mind that might benefit from it! thanks for making this free and accessible!
3,L_justtheletter,"Great interface, as others have mentioned. The videos don’t have subtitles, or whatever UI element I’m supposed to click on to see them is shockingly not obvious. I’m really shocked at this. I can’t use videos without subtitles, this is basic accessibility y’all!"
5,Chelsea6323,I can’t love this app enough. I love the introspection I’ve gained from it. It’s absolutely free. No ads. No gimmicks. Just care and respect. I love the mental health hotline resources. It’s phenomenal. And beautiful.
5,XoChichiXo,This app has helped me in many ways.  I always have trouble expressing my feelings.  This has helped me put a name to what I feel and be able to share it.
4,greengxblin,I absolutely loved this app and used it for so long but didn’t realize my data would erase if I deleted and redownloaded the app to try to fix a glitch. I’m so bummed and now I don’t want to start over.
5,(🤓),"As a digital graphic designer, I can attest that this app is designed to perfection. It is so beautiful and easy to use. Every design decision made reinforces its core concept—accepting our emotions as they are."
5,KalebCra,It’s really helped me and my partner communicate our emotions without having to come searching for help. It’s a good way to really come to terms with our emotions and feelings.
5,NP831,What a wonderful tool.  Easy to use and so helpful.  Helps give a better voice to my feelings and to be able to journal connected to the emotion is great.
5,Opinionator55,I love this app! It has been a fantastic tool for me as I try to understand myself and navigate my emotions. I love the layout and user experience.
5,egb.2,I love this app. The ease of choice makes this very accessible and easy to use no matter what the feeling may be. I love the analytics as well as the helpful videos. Very well done.
5,selfloveclub,"five stars because its like the app actually cares about you. i love being checked up on, and i love the fact that it takes data. knowing that i've been happier lately, somehow makes me even more happy? if that makes sense. this is amazing because theres no ads, and its a non-profit. they don't want anything from you, and it feels safe. its educational, and probably the best self healing app out there right now."
5,caexman,Love the lessons and the options available within this app. I feel like I can save my impressions of my life and each of my days without wasting my time. Love this app!!
3,Dsfrede,"I can see how this can be useful, but it seems like either your Pleasant, Low Energy side needs some choices for those who aren’t feeling bad, per se, but aren’t feeling really good, either (sort of a Meh equivalent but falling on the pleasant side) or you need a neutral section."
5,SD34569483,This app has helped me so much with identifying my feelings and why I’m feeling them and it’s also just my journey of knowing that my feelings are valid
5,ExpatTravel,"This app is so helpful and offers great features and tips for tracking your emotions and what they’re related to. Very easy to use, and quick."
5,LouveniaM,"This app is better then advertised better then average. Informal encouraging ,and helpful. Love all the features and user interface is great . Keep up the great work ."
5,Cbcomeau,"I’ve only been using this app for a couple of days so far, but it’s amazing! The way it helps to narrow down emotions helps to get to the root of my feelings."
5,Hedge funds kill all,I came across this after reading Marc Bracket’s book Permission to Feel. I believe he was involved in this app.  Well constructed and beautiful app which delivers some very nice social emotional learning!
5,markwyner,"This app is really well thought out. My therapist recommended it and I am loving it. It’s not like changing (at least yet, my first week in) but it feels good to be on a path of emotion analysis."
3,CaLyDo,I often find myself looking for additional emotion words that are not included.  The app needs a more comprehensive list of emotions to choose from. I also don’t agree with how some of the emotions are categorized as high vs low energy.
5,E Mitchell,I’ve not loved an app more.   I only wish we could add feelings or submit to get them added. I could use things like”incredulous” or “flat” or “bemused”for instance.
3,KayStarr44,"The only issue I have is it absolutely will not synch my sleep or steps data, despite the permission being allowed.  It only syncs my cycle.  Otherwise, it’s great but could definitely use an option to have more than one emotion at a time."
5,Gotnonickname123,"I never review apps, but this one deserves it. It has so many useful features, and has been such an amazing tool on my self healing - growth journey. It’s a 10/10 for me!"
5,WOGWM,This is such an excellent app. I have been sharing t with clients and using it myself. I’m so well pleased. And for  it to be free due to donars is encouraging and makes me more willing to donate and give money.
5,ClayHarrisNC,"Love the app - wondering if the app could write back check-ins to Apple’s Health Data, if for no other reason than to enable further integrations down the road."
2,Heghirfvnkhkvbmg123,I really enjoyed this app and was keeping track of my emotions and everything and I felt good about it. Then like 30 minutes ago I go to do my daily check in and all my data was erased. After a 92 day streak. All of it. Just poof. It is very disheartening so just keep a heads up about this happening.
5,jlmw1969,"…for anyone like me who needs to monitor their emotions.  Fabulous graphics, incredible lessons, so very useful and easy to record data.  Three thumbs up!"
5,robb.,This app helps me remain mindful of my feelings throughout the day. I find it helps me be more present in my feelings even when I don’t have a scheduled check-in.
5,Jesserton,I love the design and function of this app. It’s amazing and it helps me with how I’m feeling and will improve my quality of life. Thank you for making this app and making it free.
3,snrein1016,"I think an app that’s used to describe emotions, but has limited emotions and no way to add more (please let me be just missing this) is essentially useless. If the emotion I’m feeling is not here, I suppose my option is to use the closest emotion??? Feeling: frustrated, disappointed, and exhausted."
5,Raindhhf,"This is such a great app. It helps me get in touch with my emotions and how I’m feeling. I like how simple it is and easy to use. No ads, payments or anything like that. Definitely recommend!!"
5,rfranc0,The UX is stunning and using it feels effortless and informative. Really looking forward to this small and easy step to better understanding myself.
5,fed up w/ postmates2314525,"I enjoy this app so much, it’s helped me better understand my emotions and reflecting on the in a way I can track them better."
5,lunaelisef,I really like this app but I wish there was a way to add your own emotions to the categories because some of the emotions on there are too simplified
5,humongous muffin,This app is extremely helpful at noticing patterns i emotional stability and I love it so much—I’ve had it for a week and I gotta say it helps :) you should definitely download this!
5,Ahem_middleskin,This app helped me chart my feelings over the course of weeks and recognize some unhealthy patterns. I’m appreciative and recommend for anyone looking to be more mindful on the daily.
5,TerraDogToday,"Does wonders for helping me explore, understand, and keep track of my emotions. Sharing my check-ins with my partner opens up a whole new level of emotional communication!"
5,Whimsy stop smoking,I want you all to know how much I appreciate this app. I’m in the beginning stages of quitting smoking. Smoked for 50 years. I read Marc’s book and loved it and this app is fantastic!
4,Steve739472515,This app is great and I already love it but it would be a lot more useful if it was it was somehow integrated into the Apple Journal app. Like if you could see your HWF mood in the journal app because I like using both.
5,Going-going,"I loved the mood meter before, but this is awesome. I love how it tracks all the data and helps you find themes as well as helping with regulation. Two thumbs up"
5,Sleepy8123,"So for so good only used for a week now. The only thing this far I would change is the four main mood categories: high/low, energy ect."
5,you can calm down,This app is helpful when you can’t seem to calm  down and are trying to find you felling and help feel better to relax and just chill
5,mandymandy2017,The opening of the app with many tiles are my favorite part of this app! It especially helpful for someone who does not have rich expressions on emotions!
5,Melissavzq,Perfect app to keep track of my emotions while being able to capture experiences! Love it
3,Chaz0651,"I enjoy using the app, but it is rather buggy. It won’t let me fill out all the details on my check ins, which limits the apps ability to learn. Kind of defeats the purpose. Once the glitches are fixed then I’d give it a 5/5"
5,*Vibrant€ssence*,This app has been extremely helpful in getting me to check in on my moods during the day.
5,Bella J. R,"i love this app its one of prob my fav on my phone. my only question is i turned on notifications, and i only get like 3 a week. how do i change it to twice a day?"
5,cosmic ghost 9076,I love this app so much but maybe when you put in how long you slept for it could have a minute thing along with the hours
5,SticknKick,The How we feel app is wonderful for getting in touch with emotions and figuring out how to deal and make space for them in our minds.
5,Dtudr,Please allow us to change the time of the check-in in the edit feature! Thank you!
4,SaltedSoju,I really enjoy this app and how it allows me to learn to put words to emotions but it would be nice if there were some neutral emotion options. Sometimes the green and blue emotions are a little too strong for what i'm currently feeling
5,Shockboys,"This app is an instant quality of life improver, seeing patterns in moods and feelings is so helpful and this app helps build community with the people I share with. Love it dearly, use it daily"
5,Adrian Nila 24,I never write reviews but this app has been such an enormous help to me as I’m going through a breakup right now. Thank you Dr. Marc Brackett and to anyone who’s helped on the app.
5,cannonpatriot,I did find this to be an incredibly helpful tool that I didn’t even know I needed it. There’s no reason not to use it give it a try I love it.
5,Akidderz,really love this app. couple weeks of checking in and lessons and i feel like i’m learning about myself and becoming an emotional scientist
5,A Waalkes,Such a great & easy app to track your mental health! Simple & gives you reminders which is so helpful. Can’t wait to see my emotion data!
