score,userName,review
5,Sognatore1988,"My wife and I originally downloaded this to keep in touch with how we were feeling and it helped us a lot. We then decided to have the kids download it and use it as tool for them to keep in touch with their emotions and learn to better understand what the emotions meant. I would like to see a couple new features (selecting unlimited emotions for when you’re feeling a bunch at once and can identify them, and being able to share an emotion update with one person and a different one with another)"
5,CaliRya,"I’m a few days in and so far I’m loving this app. It’s incredibly easy to just dive right in, with just a few spare minutes a day. The design is really slick and simple. Even though the videos are usually way too fast for me to absorb all the great thoughts and ideas, I appreciate they can be slowed down. The written summary at the end is a great touch. Privacy-wise, I appreciate that my data is stored on my iPhone, not in the app’s cloud servers. I encountered very few bugs. At first the app was letting me in without a Face ID prompt, but now it’s all working as expected."
5,courtandspark86,"Hello, I really REALLY need to use this app daily and throughout the day, however, there is no way for me to get cell service while teaching at school. Schools block certain services, or perhaps it’s the cell phone company that does that. Anyway, I would have to leave my classroom and go outside, and sometimes I need to go to my car, in order to use my cell service. I can’t just leave my kids to do that. We are SUCH a vulnerable population that deals with student issues first, and it leaves little time to take care of ourselves. Many teachers are so depressed and anxious, and I know that this app would help so many of us. Is there a way to have an offline option or a website for logging feelings?  Who else can I reach out to about this? It’s a country wide issue guaranteed. Thank you and I look forward to hearing back and speaking with someone soon. -Mrs. Cameron Boisvert"
5,ChristineWN,"I’m diagnosed with BPII, however cycles are so rare that I didn’t recognize it was happening.   My therapist assigned me the task of tracking my moods & I chose this app because I liked what I read about your project.   I’m two weeks in and I’m amazed. This is the best app/method ever. Bonus points for crunching LOTS of data in a simple visual way. I’m seeing my therapist next week and will have her look into this & perhaps recommending to other clients.  One TINY fix needed. Sorry to put it in a review, but I can’t find a way to contact support. In the ANALYZE/WEEKLY/Your emotions during the week….the chart is populating one day ahead. Today is Tuesday, but Wednesday is reflecting today’s check-ins. The chart begins with Monday. If it began with Sunday, it would work.  Overall, fantastic app, the needed fix doesn’t impact the usage at all, so I’m 100% happy with it. Thank you for a much-needed method and for making it free. Bless you."
5,J_Thrasher1,"I’ve never been too fluent with my emotions and this app has been so much more helpful than I had ever expected. A friend recommended it to me and as soon as I saw that each emotion had a description I fell in love. As a guy I kinda know what all of those emotions meant but, being able to see them in their distinct categories with descriptions has allowed me to understand my feelings MUCH better. I haven’t been using the app for too long but I am also very excited to start using the analyze section to look for patterns!"
5,besiendodnsns,"This app is like my fitness pal for mental and emotional health. I love the data visualizations and the design so much. I completely trust this app to help me identify my feelings, define them, and work through them. I’ve been telling all my friends about this and will share it with my coworkers as well.  It’s a great alternative to doom scrolling on social media or trauma dumping on friends. I can just open the app, check in with my feelings very quickly and be done. It’s a simple, yet cathartic feeling that takes little to no effort to stay consistent with."
5,lulusdn,"I’ve been using this app for months now and it really gives me an insight on my emotions and how well my mental health is and ways to improve it. It has helped me become more aware of my emotions and truly helped me practice checking in on myself and my feelings. I seriously recommend this app as it continuously updates emotions and adds new ones and it improved to the better and I appreciate such helpful app thats for free, no ads, nor subscription.  Thank you so much for this wonderful app, grateful for such innovative mental health awareness/support."
5,The Real Guapo,"When I have the urge to pick up my phone, instead of scrolling on Instagram or playing mindless games, I check in with my feelings with How We Feel. My therapist reccommended it to me and I love it! It is so satisfying with the colors and shapes of the emotions and there are so many emotions to choose from. I like that I can track patterns of my emotions and see how often they change throughout the day. I also really enjoy the informational videos and tools the app has. Would 10/10 recommend this app and I am so grateful that it is free!"
4,St. Elvira,"I started using this app about a week ago to track my moods. I find that most of the time the 4 energy levels to choose from hardly match the description of my moods. For example I’m jittery but I’m not feeling high energy but in order to select that feeling I have to choose high energy. It would be helpful if you could choose your energy level and then allow users to choose from all the pre-listed feelings whether they correspond to each of the listed energy levels or not. Other than that, the app is really helpful."
5,madhavvv_s,"I LOVE THIS APP!!! I have ADHD and apps like this designed for self-help don’t tend to usually be as fun to use as this one! The UI interface and design is sooooooo visually appealing to the point where i’m almost excited to track my emotions 2x a day- and I’m NOT someone that loves to feel my feelings. I love how easy, simple, and effective this app is. The variety of emotions offered and the little description under each one help me really articulate what i’m feeling as i normally have trouble really identifying what exactly i’m feeling. THANK YOU FOR THIS"
5,olivia12,"I’ve used lots and lots of self help apps, and I’m confident in saying that this one is my favorite.  The UI is simple but engaging, the terms are intuitive and really do help in my unraveling my true feelings. I love the analytics it provides.  I also appreciate how this is backed by researchers and supported by donation, it’s tough to put money up for apps relating to self help when I’m already paying for therapy/psychiatrist/etc. And this app really feels like a labor of love unconcerned with making a profit off its users.  I’ll definitely be making a donation!  1 consideration, I’ve had difficulty syncing my menstrual data to this. I use a separate app, which connects to Apple health, which in turn connects to this app, but it hasn’t fully synced together yet. Not a dealbreaker and something that might need to be re-set or something. But all in all an amazing app and highly recommended!!!"
5,Tanya1140,I really am enjoying this app. It’s nice that I’m able to find the way I’m feeling through a choice of options. It’s helpful since sometimes I find it difficult to find the word. It’s super easy to use and helpful. I’ve been able to pinpoint what triggers my moods by using this app over the past couple months. It tracks it by the places you are and who you’re with and what you’re doing. I absolutely encourage everyone to use this app since it helps you become aware of your mental health triggers.
4,Razzmatazz11,"I was only introduced to this app 2 days ago and it’s been so helpful. My number one hiccup is I cannot ID my feelings. I just draw blanks.  This app is cool because it gives definitions of the feelings and I’ll just be scrolling through and I recognize something and it fits. I had no idea I was feeling so many things. I know that sounds dumb, but feelings were not validated when I was growing up, you shoved them away.   The tools are proving to be helpful. I’ve only just begun to explore, but the sounds section is fascinating in that you can create your own music. I get mesmerized and it helps me to relax.   My one suggestion that I offer is that during check ins we need space to select more than 2 feelings. Given that ability and I’d give this app 5 stars in a heartbeat. I sent an email to the creators and they’ve already responded and that was nice.   And the app is really free free. No leveling up, no subscriptions. The app is a godsend."
5,Jessie_Smith19,"I love everything about this app, from the simple and colorful design to the concept of learning to watch and track your emotions. The app is so well design and user Freud my that you don’t even need instructions to start….it is self explanatory. I also really love that it is a non-profit app funded by donations!  Personally, I’ve been trying to learn more about my emotions and feelings for years. This app, and it’s ease of use, are undoubtedly going to help me get to a better place of understanding myself and therefore the world.  Thank you for this app!!!!!"
5,lausyreviewer,"Really enjoy the simple interface for emotion descriptors and the corresponding coping strategies/tools as well as the community aspect. One of my friends checked in as “disappointed” and when I messaged her to see what was going on, she said, “wow this app really works.” It’s a great way to stay connected to close friends.   My suggestion for further improvement would be to allow for multiple feelings to be selected at once, as I’ve had times where I held both positive and negative emotions at the same time."
5,Upset-Vet,"I am honestly pretty shocked at how big of a difference simply keeping track of my emotions through the day has made. I find myself checking in with my inner workings far more often than I would typically. Instead of assuming I feel down just because, I’ve noticed myself implementing certain actions to help improve my mood. Frankly, I’m impressed. I downloaded this on a whim, but I think it’s a keeper. I considered myself to be a relatively emotionally intelligent person, but this app really encourages me to hold space for what I’m experiencing. A+"
5,Joda990,"I like the ability to do random reminders to get more varied data.  I like the organization of the feelings since surrounding feelings are all related and often used as synonyms, so that helps me to get a sense of what feelings often go together and be more specific.  I wish there was a section for a true gratitude journal in the app too, so I could consolidate my mindfulness apps, but if that would detract from the mission of HWF then I much rather the great attention to detail the have put into their existing features."
5,DonCarreto,"I have been working on being connected to my emotions, more aware of my thinking thought patterns and feelings. This is my third day of using the application and the results are amazing! My favorites are the daily scheduled emotion check-in and the small video with a short explanation from the experts while providing simple tools or quick exercise to help you cope with negative and positive emotions. My favorite personal edd evelopment app who knew feeling was so much fun?! Already recommended to couple of friends. Thank you HWF!!"
5,Blakebrands,"After a series of events caused my mental and emotional states to deteriorate into a very dark and dangerous place, I didn’t think I could go on living my life in a way that would be good or even tolerable. I lost my dad, my stepdad, and my favorite aunt in a single year. It was the worst time in my life and I had no desire to participate in life. I didn’t look for help, ask for it or even consider.l it. Thankfully, this app found me. The teachings, the affirmations, the journal entries all helped me learn and understand my emotions and what exactly they mean.   B"
5,Grape_Jelly23,"This application has helped me so much. Whenever I feel a negative or even positive emotion I log it into the app and it helps me feel so much better. The various different charts allow me to discover ways to feel better about myself and current situation.  The mediation and breathing exercises help as well, because they provide guidance and there is a sense of customizable by putting your different exercises into favorites.   Overall this app has transformed many aspects in my life, and it’s completely free."
4,Yeika21,"I love this app! It’s so satisfying scrolling to find what i’m feeling at the moment. I also absolutely love that you guys explain every feeling because it can teach me to communicate better, but also because my 1st language is not english.  However, there’s this glitch that’s very annoying… Every time I check in a feeling and I write, as soon as I stop writing the screen goes black and it won’t let me do anything. Ig I have to edit something, I have to close the app and open again just to edit… Every time! Hope you guys can fix this, other than that, the app is amazing!"
4,Albertoeda97,"The headline is: This is a great app. It is helpful to explore the grid of emotions to find a more precise word to express what you feel. This has helped me question what I feel exactly, and why it might be. Just looking at the list has made me wonder why some of these emotions are missing in my life, and that reflection has helped me to lean into more positive emotions.  There is only one thing that actually bothers me about the app: The lessons are overly cinematic, almost epic, and they feel out of place, inauthentic. I would prefer a more familiar, natural approach to the same script."
5,chrissy tn,"Really great app, love the concept of it. Strategies are super helpful, and the app itself i very user-friendly. Been recommending it to everyone.    BUT — issue is that when I go back to any previous emotion check-ins to edit the exercise hours, ALL my recorded checkins (literally since the very first checkin I’ve had with the app) automatically turns to 45 minutes (weird). Then it also makes all my previous sleep logs 5 hours. Completely throws off the accuracy of the overall analysis chart overviews."
5,Walk with me.dawn,"My youngest son recently invited our family to join him on the How I Feel App and share our emotions with each other with a daily check in. This app provides emotional connection, personal and interpersonal,  and short instructional videos that teach how to assess your emotions, and techniques to reduce anxiety and stress for good self-care.  You will also find online journaling and help-lines for mental health support within ‘How I Feel’ app. It is an excellent resource for maintaining good health in Mind and Body. I  am grateful for the creators of How I Feel."
4,Smileashx3,"The app is wonderful to use so far, and I really enjoy my experience when I remember to use it. Yes, the app does let you set the notifications to come as daily reminders, and I even appreciate the “surprise me at a random time option”. However, once I open my phone, the banner is gone and there’s no badges to indicate a notification on the app icon. I need that little red number to remind me to check in if I ignore the banner, and I believe I would check in more if the notifications were more prominent. Great app nonetheless!"
4,Kiwiiiii2005,"Would love to see more interaction from the developers with the community using there app. I’ve seen no feedback in these reviews from developers to there community, and very little improvement from the community complaints. Would love to see a feature to add or create your own emotions along with the color they are associated with. Maybe a feature to share those emotions with freinds. Another issue I have is wanting to add a feeling to days I missed, even if it doesn’t keep the streak going I should be able to log my emotions for that day."
4,Asaskew,"I absolutely love this app. It really helps me be more present throughout the day and mindful of how I’m feeling. I like the fact that you can track how you feel at certain times of the day, doing different activities, or who you are with.   With that said; I think the feelings to choose from should reflect the popular “feelings wheel.” I feel the four categories is limiting to what the true human experience is. There definitely is more nuance to feelings than just low/high energy & pleasant/unpleasant. Please add more categories of feelings!"
5,Nefezuri,"This has truly been a tool that I look forward to using daily. In my life I have suffered with bouts of depression either due to needed surgeries or drastic life changes. I didn’t have a tool to help with this until now. I am grateful for the ingenuity & creation of this app with its helpful tools & a way to help me in monitoring my emotions/feelings. I was looking for something like this to help me,this year with December Holidays. I now feel empowered with the tools I have at my fingertips.   In Gratitude, A (PS-shout out to Bruce Muzik@“Love at First Fight” for the intro to this app)"
5,NekoEsmahh,"Are you able to add a feature where you ask us questions and challenges every day? Like a little prompt area that engages us to write about something. I find myself not using the app as often for the lack of initiative. Maybe you guys could help?  And challenges could be something like going or doing stuff that will make us feel a certain way, I guess. Maybe even take a picture or record it to have a little memory of it for the future."
5,Ranch Smoothie,"I am autistic, and struggle with recognizing my feelings due to years of masking. This app has helped me in ways I didn’t even know I needed help. Everyone I have recommended the app to also greatly enjoys the app, even the people who aren’t on the spectrum. Emotions can be hard to notice patterns with; this app has helped me learn the patterns of my feelings and behaviors so I can make the proper adjustments to feel more validated and fulfilled. I can’t recommend this app enough! It’s the best app I have ever downloaded."
5,han1banan,"This app has been a breath of fresh air. I’ve been using it for as little under a week now; and I absolutely love  it! It’s easy to use and I love how I’m drawing more awareness to my emotions with each check in. I already feel at ease. Feelings come and go, and that’s such a nice thing to acknowledge. I can’t wait to keep using this app! They did a great job making it, and I feel honored to be a part of it. Definitely download and start using it today! You won’t be disappointed, you’ll love it."
4,Danashmore,"Love this app - it has really helped me recognize that when I feel ‘unpleasant’ it won’t last forever. A few suggestions/comments: 1. In the ‘analyze’ section, where it has the 7 vertical bars, for some reason it has Sunday all the way to the right, even though it is the first day of the week. 2. it would be really nice for those bars to indicate the emotions felt throughout the day chronologically rather than just stacking them by frequency. 3. The sleep field does not read automatically, so I have to add it each day."
4,Your dry,"So I been using this app for like 3 years now. I don’t use is everyday but I go through tons where I will use it everyday for a few weeks and then not use it again for a few weeks. Just in and off. I like that this app doesn’t make me feel guilty for how I feel. I LOVE the ‘reflect’ and ‘affirmations’ addition. It really helps me feel so much better especially because I don’t feel like I can talk to anyone about how I feel in real life. It is nice to get feedback and support, even if it is chat gpt. It’s really helpful. I hope they keep improving."
5,Riot :),This app has been very helpful for remember to be present when I’m having an emotion as an Audhd person this is really difficult especially because my adhd will kick in so I forget I have the feeling once i notice it which isn’t great. So this app has been helpful because it gives me a designated amount place to put the feeling when im having it instead of panicking and not knowing what to do with it.   I do wish there were a widget for it so it’d be a bigger tile on my phone
5,Frank01346,I love this app! My therapist recommended this to me and I love it because it helps me keep track of what I’m feeling and any patterns and it’s easy to use. However I do have one suggestion. I wish that you could set up different times for different days because I have different schedules for each day and I am not up on the weekends when my reminder goes off to check in and I can’t set it later because I have school at that time I want to set it but I love the app and keep up the great work!
5,MK17081!,"I have been using this app for about a year now and absolutely love how it works. It is so easy for me to be able to see how much of 1 color I experience in a month and helps me understand what color I mostly stay in. I even have my dad using the app now so we can have better communicate and when I go to my therapy sessions I now have a way I can talk about things that are going on because I can now look back and see what I wrote. I even have my therapist using it and she has even told some of her other clients about it.  I do however have a mini complaint. When I want to upload a photo when you get to the part where you can. I wish there was a way to change the color of the text, so it could show up better when there is a picture that was taken in the daytime.  Otherwise, would totally recommend!!"
5,merylstreep is my mom,"Highly, highly recommend. I couldn’t write a better review for an app. This app has been a life changer and has seriously saved me. It’s given me a safe space to not only identify the sometimes difficult emotions that I’m feeling, but it helps me put them into words, which is crucial when processing trauma and hard (or big happy) life events. The analyzation tools included in the app allow you to see patterns over time, and honestly, I wish I had just found this sooner!"
3,Madds-G,"I like this app a lot. It’s helped me put words to my emotions and works as a processing tool that later helps me when I’m discussing my feelings with someone else. The interface is clean and creative. The app organizes information in a format that is easy to digest and understand.   However, the emotions that are available are sometimes too broad to fully capture with one word. I wish that there were more available options that sit on the fence between categories (e.g., bittersweet). There have been multiple occasions where the words don’t feel like the right label for my emotional state."
4,ml897,"I love this! Me and my partner use it and we share how we feel. It’s also so beneficial to have a wide range of emotions and to be able to track how you feel, when, with who, doing what, etc. it helps show patterns in how we feel.   However, I would like even more emotions and an option to add new ones. Also, identifying emotions is difficult and I love that the emotions are split up into four groups, but I wish there was an option to help identifying emotions even more (ex. If you have a low mood, do you feel more sadness or tiredness)"
5,M. E. Alvarez,"I found this app November of last year and introduced it to my friends, since we were all going through a pretty hard time. We’ve loved the app ever since, and I’ve even introduced it to my parents. But theres o e bug I noticed and I have no idea if it’s just my phone bugging out. The Even-Tempered icon keeps changing randomly throughout the day, and when I look at the Analyze tab, it has no icon because it has no specific icon. It drives me slightly insane. Is it just me?"
5,Chondrion,"I have a hard time expressing and naming my emotions. This helps a lot. The only suggestions/requests that I would have is to allow for multiple emotions in the same check in (sometimes I’m feeling accomplished, but also a bit irritated) and ability to use a watch app for logging emotions as I don’t have access to my phone during my work day, but do have my watch.  Edit: I was reading other reviews and noticed that 2 are possible at the same time. :-)"
5,blueraffa,"Where one would expect this program to fall flat, it is actually a lesson in revelation. Understanding your feelings is powerful. Understanding your feelings change is meaningful. Understanding how often they do is revealing: through videos and guides this is truly a program that unlocks you to be a better you by allowing you insights into your yourself that are relevant and will give you a better balance  going forward. Deceptively simple. Incredibly powerful. A must have app."
3,Universe Observer,"21 Jul 2023 - I have been using this on and off for over a week, generally two entries a day.  The biggest issue I have is that the app suffers from crashes almost every time I use it and the crashes do not seem to be device dependent.  It occurs on the iPhone 13 Pro Max, iPad Pro 12.9” Gen 3 and Gen 5 devices, all of which are on OS 16.5.1(c).  I am still trying to figure out why weather and sleep entries are required as they do not seem to have relative value that is correlated to the condition that you feel you are in.  I know that they should have some bearing; but there is no physical correlation in the graph related reports."
