score,userName,review
5,Elykahn,"I have been absolutely loving this app, from the beginning the tone and language used is welcoming, warm, supportive and encouraging. I am a designer myself and I find the majority of apps are functional but devoid of character and this app maintains the ease of use (and even facilitates it) with a lot of character that makes reporting my feelings fun even when I’m not feeling like anything would be fun, the playfulness and abstraction in no way takes away from the experience and the human descriptions in the videos are so calm and purely helpful that they are not threatening the way self-improvement videos can be. They don’t make me feel bad for not having done a suggestion, just optimistic that I can see benefits from trying it.  My main point of improvement is that I have input a sizable number of check-ins on my iPad and others on my iPhone and although the two apps appear to be sharing the same identifier they don’t compile the data to get the full picture and that would be a huge improvement for me since I can’t easily compare the times that I am using one or the other. I looked for a way to export my data and import it to the other device(the long route) but I didn’t find anything, ultimately the best solution would be automatic sync. Keep up the great work!"
4,chocosprinkles,"my therapist recommended my girlfriend and i try using this app to improve our communication, and it’s done wonders! it’s expanded my vocabulary when it comes to describing my emotions, and made it much easier to communicate to her and to others how i’m feeling. it’s been a great tool for me in my mental health journey.   i was disappointed to see the addition of AI to an app i use to journal my emotions and inner thoughts. i don’t like the idea that my private thoughts might be used to train the AI, and it feels unnecessary in an app like this. i understand the intention is to help people gain insight into why they’re feeling a certain way, however it feels like users are expected to take mental health advice from or confide in a robot with no mental health training. it feels impersonal to me, and saddened me to see this feature on an app i use daily.   i would have loved to see these resources used to add other useful features; more to the incredibly helpful “tools” section of the app, an option to enter custom emotions with descriptions, or a quiz of some kind that can be taken to help identify the correct emotion word one can attribute to any given moment, to name a few. the AI might be great for some, but personally, it caused me to lose faith in the app and made me sad when i feel like there could be more helpful features added with the resources used to add an unnecessary AI."
5,Brian Rosenzweig,"Over the past few months I’ve been trying to understand myself on a deeper level. I lost my way and with a bunch of personal stuff, I found myself burying my emotions in numbing and medicating behavior (not substances but other means). Now that I finally stopped, every emotion is coming out at once and for awhile, I had no idea how to deal with them. It developed into a deep sadness and I had no idea what to do. My therapist recommended this app to me and after trying it, it’s made my life much better. First off, it’s free. You never see a free app like this because of the usual paywalls and subscriptions. Second, it gives me a chance to consider what emotion(s) I’m feeling and helps me talk it out. Going deeper with it gives me choices and chances to tell myself how to feel better and what to do to soothe any nerves or negative emotions. I’ve been using this app for over 40 days straight and it’s definitely helped me through rough times, especially with it being finals season. Thank you for this app. It will help people more than you would think possible. I think everyone should use it! Only complaint is the exercise and sleep measurement feature but I can easily try and fix that. I’m sure it works if I pick the right options."
5,Rylee_Natalie,"I love love this app. I share it with my friends and family. I love the ease - 4 choices to start, definitions of each emotion, and minimal typing the whole way. Unless you want to type a description of your moment, all aspects that are tracked are pre labeled buttons like “home” “mom” and “resting.” Those buttons are customizable and you can delete ones that dont apply to you. Navigating the emotion page is so user friendly, hope it doesnt change. I also appreciate how you dont need to log certain things like what you were doing, or how much exercise you had. The exercise log is very discreet for those of us who are sensitive to even small pressures to work out.   My only suggestion is to be able to go back and edit the time of day an entry is. Sometimes when I am working, I want to log my emotions. I cant because Im not allowed to have my phone on me, but I want to be able to log it after work and then edit the time so it reflects when that emotion happened. I think that same idea could be helpful in a variety of situations, like not wanting to make an entry around certain people, not realizing how you were feeling until later, etc"
4,Bookreader216,"I am autistic and can struggle with labeling emotions in the moment, so this is a good way to center myself with that. However, I feel like there should be an option for a secondary emotion that you can add if there is one or if a feeling is more complex. Like if you’re feeling content and accepted in a moment and at the same time sad for all the time you didn’t get that. Or relaxed and unfocused in the moment and having a waxing and waning anxiety about the fact that that will come back to haunt you, but deciding not to care. Feelings are often more than one thing and only by taking in the whole picture can you get a full understanding of them. Heck, even with the options that are there, the fact that some form of grief isn’t an option is kinda wild even though that is it’s own thing? Or that there’s a humiliated option but not an embarrassed one? Or even like infatuated, flirty, flattered, romantic, or aroused, which is a spectrum of emotion that could technically fall under “compassionate” or “ecstatic” or something like that, but are also their own thing? Overall I think is this a fantastic starting point and I hope in the future they build in more features to capture a fuller range of the human emotional experience, creating a more precise tool for the people who use it."
3,Newtonswdc,"No journaling app is complete without an export feature that sends our text entry data to a standard format like PDF, TXT or RTF. ** ** Because all our notes, epiphanies, realizations, etc, are stored on the DEVICE and not on their servers if something happens to the device or to the app, we’re out of luck and all our notes may DISAPPEAR. What’s a worse way to make a person feel lost, confused, and miserable than to realize an entire year’s worth of journal entries is GONE FOREVER because they dropped their phone or the app crashed unexpectedly? ** In fact, just now I was leaving a review through the app and the app FROZE on me. Thankfully no other data was lost this time but I think I’m making my point. ** I’m not saying the developers should find a way to store all the photos and audio recordings, that would be too cumbersome, just a way to store the date and time and all the notes we write for each entry and export that to a standard format like PDF, TEXT, and/or RTF. ** We should have multiple means of export like: Phone drive, email, Dropbox, etc. ** It would also be nice to include a feature that allows the ability to sync the data among multiple devices on a single Apple ID. I would be willing to pay extra for those export & sync features. ** Then the app would be perfect."
2,Anetzzz,"Update: developers emailed me acknowledging my initial feedback but the app did not change for the better. I stopped using it because of how it still forces you to manually bypass Reasons, instead of letting the default be just log your emotions and manually choose to enter Reason. Now I came back after a month because of an intense emotional day, for one reason: to use the guided ‘solution’ option it had originally. When I first downloaded the app if you out in an emotion it would link that to a suggested solution, a movement or a rethink or a video. Now there no suggestion based on your entered emotion. So we the people are who struggle are left to browse the solutions and wow somehow just know which one is going to help us? Sorry that is not helpful. I can get the same stuff with a google search. Had to delete the app, it’s not living up to its potential. Initial feedback: Liking this app, helps me be better tuned in to my actual emotions. Recent update forced you to open the Reason entry page. Previously you could opt to open this entry page. Please allow the norm to be a dual option: bypass or enter. I hate having to click extra when I don’t have a reason I want to enter. I also hate how this feels like data mining. Thank you for considering how the current UI impacts the feelings of users."
5,saladtuna,"I love the simple design of How We Feel. The matrix of emotion words is really helpful and easy to use, I find it much easier to just open the app and log my emotions than to journal. The best part of the app is that all of the features are actually completely free, the lessons on understanding your emotions, de-stressing exercises, emotion word matrix, additional journaling features, and mood analysis are all free and there are no subscriptions to be seen. I really recommend How We Feel to anyone who already likes journaling and mindfulness, who is like me and is very bad at forming new habits, or just anyone who feels curious about understanding their own emotions better. The analysis tab lets you look at all your logged moods over time so you can start to see patterns emerge. Do you log being fatigued more often when you have a big project you’re working on? Do you log more positive emotions in summer and spring than winter and fall? Would also be useful for anyone starting on mental health recovery who would like to track their progress over time. Overall wonderful completely free app with tons of features you can use at your own pace."
5,Duckluv,"As someone who has been struggling with a lot of various brain traumas, leading me to become isolated and feeling hopeless, I am having such a good experience reconnecting with myself thru this app. I have been going through a lot mentally and it’s been getting harder and harder the past few years to talk to people and make friends and feel good about myself. With the help from my doctor, self evaluating, and asking many MANYYYYY questions, I was finally able to talk about my experiences and how it affected the way I thought about myself and the world around me. This app is such a wonderfully made and well thought out tool for people to use and benefit from!! And it is also really rewarding to be able to see a physical representation of my thoughts and feelings adapting to life’s changes. Life is so hard to keep up with for me emotionally and I’m writing this long review because I believe we all have the power and tools within our thoughts and brains to help ourselves get better every day ❤️if the developers are reading this I would like to say thank you for all your help in my self healing journey, it’s greatly appreciated❤️"
5,MeelsM7,"How we feel has been very helpful with figuring out how I feel when I’m asked, which has been something that I have found very frustrating, as well as when I have overwhelming feelings I might not know how to deal with yet! It’s also been very helpful in communicating my feelings more effectively with my family and friends!! If I could change one thing about the app I think I would add a feature that allows me to change the color of the feeling that I choose for the specific entry. Not for the overall category of the feeling but so I have more range to express exactly how I’m feeling whether that’s in a private or shared entry. For example when I am using the app sometimes the word will describe how I’m feeling however because it is a harsh red color my brain immediately causes me to feel that it’s negative, that feeling “uneasy” is bad even if it’s just mild, and that gives me a little anxiety sometimes. (Which in itself is no big deal! But for the overall comfort of expressing how you feel I think it would be helpful!)"
2,Leeloominai_D,"Two stars because it’s the only emotion app that i’ll actually use, the rest of them trigger that utter rejection thing my adhd brain does where i have to get it away from me asap before the boredom it induces becomes too painful. This one doesn’t do that, so yay there. Visually appealing. Emotional choices are limited and not customizable leaving the app culturally prescriptive (white-washy/male supremacy-based/based on status quo, not inclusive etc) and not descriptive. None of the synch to health or weather options work accurately so if you use those features and actually look through the data you realize it’s all inaccurate and you have to go back in and add them manually which takes too long to bother with it if you’re already busy so basically just makes those features useless. The period reports were clearly designed by someone who has never had a period, so even if that part synchs who cares because the data it’s charting isn’t useful to anyone who actually has periods - so it’s like cool chart but who cares on that one. Seems like a good beta release with a lot of potential but it’s definitely not there yet. The feedback team is very responsive and assures me it’s still a work in progress, so we’ll see how it goes."
5,Kur0taku,"Edit: this issue has finally been fixed! Now been able to access my old entries, make new ones and keep it all backed up 🤩  This is honestly meant to be a 5-star review because this app has done so much to help me connect with myself and my loved ones in the 3 or so months I’ve used it. An intuitive premise that is efficiently executed, I’ve found my experience using this to not only be really empowering, but also an essential aid in keeping myself regular with mental health check-ins - not to mention vastly expanding my vocabulary and toolset to express and explore difficult experiences and emotions. Ultimately, I’d gladly revise my star rating as soon as I get this one bug worked out - my app has been crashing on startup every time I’ve attempted to use it since the last update, and unfortunately I wasn’t aware if/that iCloud sync had been available when I started using it. I’d love it if I could regain access to the app without having to lose the previous data I’ve accumulated, so fingers crossed that this gets noticed 🤞🏾"
5,appiaha,"Love this app, it provides a convenient way to document my days and I love using data to really see how I have been feeling. I use it as my full on journal now! There are two things that would make it even better, 1) being able to record a voice memo without having to keep holding down the button at the same time. Sometimes I just want to press record, and talk while I’m multitasking and this would make it more convenient. 2) being able to have a log in so that we can access our journal anywhere - without this, if we have to delete the app and redownload later for any reason (ie. Not enough phone storage), we won’t lose all of our entries. I’ve had to delete it a few times and it is frustrating to see that we lose all that data that we collected over a few months!  Otherwise, love the app, it’s aesthetically pleasing and simplistic - I recommend it to my friends all the time. I hope the team continues to add new words!"
5,Coco bakery,"wow, I never write reviews for apps but I just love this app so much. Its helped me drastically get in touch with my feelings, i've been able to become more mindful, as well as increase the joy in my life. I love the features like being able take a picture, the color coordination, and the analysis option where we can examine our feelings over time.  I also loved the little videos in the beginning, i found them very helpful. Generally I love this app, I use it alot and its improved my life and my relationships with the people around me.   If I could offer a suggestion it would be to configure a way to add more specific feelings. Sometimes i feel a very specific emotion and Im unable to properly document it. Being able to see the different emotions is extremely helpful though. Sometimes I also feel alot of different emotions all at once. I might just be a specific audience but those would be cool. Thank you for creating such a great app and allowing us to use it for free!  All Love, Evie"
3,psychicdaydreams,"Sometimes I'm avoidant, bummed, spiraling, distracted, on edge, aroused, verklempt. (Not an exhaustive list.) But if I'm feeling any of those things and using this app, I can't accurately describe... how I feel. Which makes me feel frustrated. At least if I ever get ""canceled"" I have an entry for that 🙄 I disagree with the categorization of some of the emotions as ""pleasant/unpleasant,"" such as fragile (should be unpleasant), astonished (it depends), and impassioned/passionate (again, it depends). I also feel like it's in general missing the ability to clearly represent singular emotions that are by definition not clearly one or the other, such as bittersweet. On a UX level, I didn't find it intuitive that emotions not listed on the grid would be available in search, and I didn't realize the plus allowed you to add a second emotion for a good week. I've also kept experiencing this one annoying thing with trying to enter emotions where as soon as I tap away from the search bar, it autocorrects, and so the first few letters of whatever I was searching for changes to something else, so I have to go back and type it in again."
5,threew33ks_4k!dz,"This app is simple. But the interface is cute and makes tracking moods less of a “blah” habit. A major perk of the app is being able to add places, situations, and people in addition to the preset ones already loaded in the app so you can better match the information you’re collecting to your own life and specifics. My spouse and I are using the app individually but use the info to check in with each other throughout the day/week as needed regarding our individual mental health and how to better support each other. Additionally, as someone who lives with chronic pain, being able to add information about my pain alongside the notes of my mood(s), - you can add 2 per check in - the life moment/situation during that specific time, where I am located, and who I am with and have it time stamped is helpful to notice triggers and/or patterns in my illnesses to sort between things in my life may be helping or hindering the illnesses."
2,dancingbrook,"I detest having to choose either high or low and pleasant or unpleasant, more so at the start.  Can’t I just be OK sometimes?  Couldn’t find a way to share these thoughts: 1) I saw a review, asking to be able to change the time entries, so one could log how they’re feeling at an earlier time, but I did not see the suggestion implemented in the version log, even though the response to review suggested developer would make that change. (Update: it seems the change was implemented but wasn’t listed in the version history) 2) When setting up the app initially, I was given 4 times of day to check in; the labels on these times didn’t make sense for my way of thinking. I’d like to be able to check in when I wake up, late morning, mid afternoon, and in the evening. These times are based on my recollection of significant periods of time where I am aware of significant mood shifts, times of acute awareness. The labels offered, morning afternoon, evening and evening didn’t seem right. 3) Selecting one mood feels too constrained; I certainly feel more than one mood at a time. 4) It needs a lock, so someone using my phone isn’t able to access my info."
5,Danie728,"Wow. Without knowing it, I’ve truly needed something like this to help me identify my emotions. I struggle to identify emotions and differentiate them. Most of the time I can’t make sense of how I am feeling. This causes me confusion and frustration and a lot of self critique. I have no idea how I stumbled upon this app, but I’m so glad I did. From the initial pick of the color, identifying my energy levels- this helps me narrow it down. I find the word that I feel best fits it and then read the description. This helps me ask myself “does that feel right?” often I need to adjust and read surrounding words but I always find something close enough (my suggestion in the search is maybe somehow provide alternatives with synonyms). With time I do feel like I am getting better at identifying what I feel in a moment myself and further to notice how often an emotion may swing within minutes and being able to document that always feels amazing."
4,Envy!!,"Other than one or two little things I absolutely love this app, it’s the only mood tracker i’ve been able to use consistently. One, I wish that you could write in your own emotions. Sometimes I know exactly what I’m feeling and it’s a little disappointing when I can’t track the feeling I have in mind. Second, I’m not a huge fan of how the exercise and sleep tracking works at the moment. I don’t think that exercise minutes should automatically apply to all the entries earlier in the day. It’s a little frustrating when I’m trying to track how exercise affects my mood and I can’t get an accurate picture of that because when I worked out at 5pm, the app applied that to all my emotions earlier in the day. The same thing goes for sleep. I think that automatically having exercise and sleep apply for the rest of the day makes sense, but you should have the option to change it, and have each entry be independent of everything that came before it."
4,TermyYT,"Hi devs, This app is awesome and I can't thank you enough for making it one that is free and runs on donations. All the other apps of this kind usually have subscriptions and I can't afford them, so it's wonderful having an app of this quality at my fingertips. With that said, I did run into one immediate issue when using the app on my iPhone XR: When scrolling down and tapping on emotions on the Check In tab, the emotion animation opens briefly and then immediately fades to black. I restart the app, open up the emotion, and it seems to be fixed at first, but once the UI with the ""Save"" button appears, it quickly fades to black again and the only fix is restarting the app again. Please fix this! It makes it hard to alter details of an emotion after its creation! Other than that, the app looks good so far. Thank you for everything.  Update: I have discovered that this issue is only on specific models. I have an iPhone XR. Please fix it for this iPhone model!"
5,Flemfive,"I think this is maybe the second time I’ve written a review in my life. I am an adolescent and family therapist and have had more success in getting resistant adolescents/families to track their mood hands down with this app. Comments such as “it’s so smooth/slick/easy” “like how it reminds me”. Thank you thank you. Feedback from real world use. Experiences often come with numerous feelings and it would be great to be able to identify more than one (I just add these to my journal lines for now). Also feelings come with physical symptoms. As part of the “noticing” it would be great to add “where do you notice that emotion in your body?”. Again could also add that in the notes function but for new trackers the prompts would be helpful. Marc, love Permission to Feel and the great work your team is doing to change our relationship with our feelings. Kudos to you and the team. Much gratefulness. Please consider adding app usage for other platforms."
5,Storyofagirl82,"I am a middle aged woman that has been through the ringer of behavioral health before it was called “Behavioral Health.” I have seen many counselors, psychiatrists, and have been to more than 1 inpatient psychiatric care facility. I like that this app allows me to track my mood over time. I love that this app gives short videos (1minute or so) to guide me through my feelings. In childhood I was kind of discouraged from having feelings- being told “you’re too sensitive.” Or not allowed to be angry because it went against my religious beliefs at the time.  What I really like- I feel no judgment, just acknowledging the feeling I’m having at the time. I also like that you add what you’re doing while having this feeling, who you’re with, and a place to write a little note- ie “I feel sad today because it’s my mom’s birthday and she’s no longer with us.” I told my counselor about this app and he agreed that it is a very useful tool."
